Full Name,Email Address,Phone,Alt Phone,Alt Email,City,State/Province,Ad Set,Submitted On,Comments,Interested Project,Handover Date
Aarav Mehta,aarav.mehta@gmail.com,+91 9820012345,,,Mumbai,Maharashtra,Sarjapur Plots Campaign,2026-06-01 10:15,"Very interested, wants site visit this weekend",Sarjapur Plots,Ready to move
Sneha Reddy,,+91 9845098450,+91 9900112233,sneha.alt@yahoo.com,Bangalore,Karnataka,Eden Park Retarget,2026-06-01 11:02,"Called twice, phone switched off",Eden Park,Dec 2026
,rohit.k@example.com,,,,,,,2026-06-02 09:00,"No name captured, junk lead from broken form",,
Priya Nair,priya.nair@example.com,9numbers-invalid,,,Kochi,Kerala,Manual Sheet,2026-06-02 14:30,Deal closed yesterday onboarding started,Meridian Tower,
Karan Shah,,,,,,,2026-06-03 08:00,No email or phone captured — skip this one,,
